"Race","Total","a. Without children","b. With children and adults","c. With only children","d. Unknown household type"
"a. White","2","1","1","0","0"
"b. Black, African American, or African","1","1","0","0","0"
"c. Asian or Asian American","1","1","0","0","0"
"d. American Indian, Alaska Native, or Indigenous","1","1","0","0","0"
"e. Native Hawaiian or Pacific Islander","2","1","1","0","0"
"f. Multiple races","25","9","13","3","0"
"g. Client Doesn't Know/Client Refused","2","2","0","0","0"
"h. Data Not Collected","3","2","0","0","1"
"i. Total","37","18","15","3","1"
